{"schema_version":1,"name":"safe","description":"Synthetic allow and deny policy.","rules":[{"id":"allow-googlebot","match":{"crawler_names":["Googlebot"],"categories":[],"path_prefixes":[],"methods":[]},"action":{"kind":"allow","rate_profile":null,"cache_ttl_seconds":null}},{"id":"deny-wp-admin","match":{"crawler_names":[],"categories":[],"path_prefixes":["/wp-admin"],"methods":["GET","POST"]},"action":{"kind":"deny","rate_profile":null,"cache_ttl_seconds":null}}]}
